{
  "schemaVersion": "xedo-inspector-save/1",
  "missionId": null,
  "expectedRevision": 0,
  "mutationId": "11111111-1111-4111-8111-111111111111",
  "intent": "save_draft",
  "document": {
    "schemaVersion": "xedo-inspector-mission/1",
    "title": "Prepared SAR review — contract example only",
    "inputMode": "mission",
    "searchGeometry": {
      "type": "Polygon",
      "coordinates": [
        [
          [
            101.2530904583859,
            12.555503611913549
          ],
          [
            101.25308967166558,
            12.555413252042761
          ],
          [
            101.25299768863019,
            12.555414024861614
          ],
          [
            101.25299611527201,
            12.555233305106595
          ],
          [
            101.25308809824331,
            12.55523253229922
          ],
          [
            101.25308888495138,
            12.555322892171318
          ],
          [
            101.25336483392469,
            12.555320573543042
          ],
          [
            101.25336640755151,
            12.555501293250849
          ],
          [
            101.2530904583859,
            12.555503611913549
          ]
        ]
      ]
    },
    "imageSelection": null,
    "analysisRef": {
      "resultId": "XEDO_SAR_20261011T130518Z_6152a5",
      "manifestSha256": "c8f543fc4732e3a059f09923e141b11d057168db91cf9119c5c1ca1bc8808147",
      "candidatesSha256": "af35d065d7570f8477e447ba1894a1c2744e8e8cb6ac4c74e3358453349e4797",
      "coverageSha256": "e56c3e20e34490f245a838f24ab8ea7f098949501e3654c504c09fb88bca5bce"
    },
    "riskDraft": {
      "baseReviewRevision": null,
      "decisions": [
        {
          "candidateId": "candidate-00001",
          "action": "accept",
          "areaId": "22222222-2222-4222-8222-222222222222"
        }
      ],
      "areas": [
        {
          "id": "22222222-2222-4222-8222-222222222222",
          "origin": "candidate",
          "sourceCandidateIds": [
            "candidate-00001"
          ],
          "rings": [
            [
              [
                101.2530904583859,
                12.555503611913549
              ],
              [
                101.25308967166558,
                12.555413252042761
              ],
              [
                101.25299768863019,
                12.555414024861614
              ],
              [
                101.25299611527201,
                12.555233305106595
              ],
              [
                101.25308809824331,
                12.55523253229922
              ],
              [
                101.25308888495138,
                12.555322892171318
              ],
              [
                101.25336483392469,
                12.555320573543042
              ],
              [
                101.25336640755151,
                12.555501293250849
              ],
              [
                101.2530904583859,
                12.555503611913549
              ]
            ]
          ]
        }
      ],
      "selectedAreaId": "22222222-2222-4222-8222-222222222222"
    },
    "planningInputs": {
      "geometry": {
        "type": "Polygon",
        "coordinates": [
          [
            [
              101.2530904583859,
              12.555503611913549
            ],
            [
              101.25308967166558,
              12.555413252042761
            ],
            [
              101.25299768863019,
              12.555414024861614
            ],
            [
              101.25299611527201,
              12.555233305106595
            ],
            [
              101.25308809824331,
              12.55523253229922
            ],
            [
              101.25308888495138,
              12.555322892171318
            ],
            [
              101.25336483392469,
              12.555320573543042
            ],
            [
              101.25336640755151,
              12.555501293250849
            ],
            [
              101.2530904583859,
              12.555503611913549
            ]
          ]
        ]
      },
      "driftEnabled": false
    }
  }
}
